{
  "schemaVersion": "starter-stylekit-owned-snapshot/v1",
  "snapshotVersion": "2.2.0",
  "immutable": true,
  "style": {
    "slug": "corporate-clean",
    "name": "企业简洁风",
    "nameEn": "Corporate Clean",
    "description": "专业简洁的企业风格，强调可读性、一致性和信任感。适合B2B SaaS、企业官网、后台管理系统。",
    "descriptionEn": "Professional and clean enterprise style emphasizing readability, consistency and trustworthiness. Ideal for B2B SaaS, corporate websites, and admin dashboards.",
    "cover": "/styles/corporate-clean.svg",
    "styleType": "visual",
    "category": "minimal",
    "tags": [],
    "colors": {
      "primary": "#1e40af",
      "secondary": "#f8fafc",
      "accent": [
        "#3b82f6",
        "#64748b",
        "#10b981"
      ]
    },
    "keywords": [
      "企业",
      "专业",
      "简洁",
      "B2B",
      "SaaS",
      "后台",
      "Dashboard"
    ],
    "keywordsEn": [],
    "compatibleWith": [],
    "classification": "base-visual",
    "globalEligibility": "eligible",
    "classificationReason": "Approved as an owned whole-product visual system with pinned source inputs and generated Web, Marketing, Docs, and Mobile adapter contracts.",
    "adapterFamily": "editorial"
  },
  "provenance": {
    "name": "StyleKit",
    "repository": "https://github.com/AnxForever/stylekit",
    "revision": "29141b684d5abb967558eb8083fbae91dbbc51b8",
    "license": "MIT",
    "sourceFiles": [
      {
        "path": "lib/styles/corporate-clean.ts",
        "sha256": "f578a7d6c53f7a9902c667495d7542d93517d7c6446ac8b2b07a7148dbe54548",
        "content": "import type { DesignStyle } from \"./types\";\n\nexport const corporateClean: DesignStyle = {\n  slug: \"corporate-clean\",\n  name: \"企业简洁风\",\n  nameEn: \"Corporate Clean\",\n  description:\n    \"专业简洁的企业风格，强调可读性、一致性和信任感。适合B2B SaaS、企业官网、后台管理系统。\",\n  descriptionEn:\n    \"Professional and clean enterprise style emphasizing readability, consistency and trustworthiness. Ideal for B2B SaaS, corporate websites, and admin dashboards.\",\n  cover: \"/styles/corporate-clean.svg\",\n  styleType: \"visual\",\n  tags: [],\n  category: \"minimal\",\n  colors: {\n    primary: \"#1e40af\",\n    secondary: \"#f8fafc\",\n    accent: [\"#3b82f6\", \"#64748b\", \"#10b981\", \"#c559f0\"],\n  },\n  keywords: [\"企业\", \"专业\", \"简洁\", \"B2B\", \"SaaS\", \"后台\", \"Dashboard\", \"minimal\", \"clean\", \"simple\"],\n  keywordsEn: [\"corporate clean\", \"corporate design\", \"enterprise ui\", \"B2B SaaS\", \"professional website\", \"clean ui\", \"admin dashboard\", \"business website\", \"SaaS landing page\", \"trustworthy design\"],\n\n  philosophy: `Corporate Clean 设计风格源于现代企业软件的设计语言，强调专业性、可信度和高效的信息传达。\n\n核心理念：\n- 专业可信：通过一致的视觉语言建立信任\n- 信息层次：清晰的标题、正文、辅助信息层级\n- 功能优先：设计服务于功能，不牺牲可用性\n- 响应迅速：流畅的交互和即时的视觉反馈\n\n设计原则：\n- 视觉一致性：所有组件必须遵循统一的视觉语言，从色彩到字体到间距保持谐调\n- 层次分明：通过颜色深浅、字号大小、留白空间建立清晰的信息层级\n- 交互反馈：每个可交互元素都必须有明确的 hover、active、focus 状态反馈\n- 响应式适配：设计必须在移动端、平板、桌面端上保持一致的体验\n- 无障碍性：确保色彩对比度符合 WCAG 2.1 AA 标准，所有交互元素可键盘访问`,\n\n  philosophyEn: `Corporate Clean design style originates from the design language of modern enterprise software, emphasizing professionalism, trustworthiness, and efficient information delivery.\n\nCore principles:\n- Professional and trustworthy: Build trust through consistent visual language\n- Information hierarchy: Clear heading, body, and auxiliary information levels\n- Function first: Design serves function without sacrificing usability\n- Responsive: Smooth interactions and immediate visual feedback`,\n\n  doList: [\n    \"使用 rounded-lg 或 rounded-xl 作为主要圆角\",\n    \"按钮使用 shadow-sm 增加层次感\",\n    \"主色使用蓝色系 (blue-600, blue-700) 传达专业感\",\n    \"背景使用 bg-slate-50 或 bg-gray-50 的浅色调\",\n    \"卡片使用 bg-white shadow-sm border border-gray-200\",\n    \"按钮 hover 时轻微上浮 hover:-translate-y-0.5 + 阴影微升 hover:shadow\",\n    \"按钮 active 时轻微缩小 active:scale-[0.98] 传达\\\"已按下\\\"的触觉确认\",\n    \"焦点状态使用 focus:ring-2 focus:ring-blue-500 focus:ring-offset-2（ring-offset 是 WCAG 合规关键）\",\n    \"卡片 hover 时 hover:-translate-y-0.5 hover:shadow-md 给出悬浮感\",\n    \"图标容器 hover 时 hover:bg-blue-500 hover:scale-110 + 图标色 group-hover:text-white 产生微交互\",\n    \"表格行使用 hover:bg-gray-50 的悬停高亮\",\n  ],\n\n  doListEn: [\n    \"Use rounded-lg or rounded-xl as primary border radius\",\n    \"Buttons use shadow-sm for added depth\",\n    \"Primary color uses blue tones (blue-600, blue-700) to convey professionalism\",\n    \"Backgrounds use light tones like bg-slate-50 or bg-gray-50\",\n    \"Cards use bg-white shadow-sm border border-gray-200\",\n    \"Button hover with slight lift hover:-translate-y-0.5 + subtle shadow upgrade hover:shadow\",\n    \"Button active with slight shrink active:scale-[0.98] for tactile press confirmation\",\n    \"Focus state uses focus:ring-2 focus:ring-blue-500 focus:ring-offset-2 (ring-offset is key for WCAG compliance)\",\n    \"Card hover with hover:-translate-y-0.5 hover:shadow-md for floating feel\",\n    \"Icon container hover with hover:bg-blue-500 hover:scale-110 + icon color group-hover:text-white for micro-interaction\",\n    \"Table rows use hover:bg-gray-50 for hover highlight\",\n  ],\n\n  dontList: [\n    \"禁止使用过于鲜艳的颜色组合\",\n    \"禁止使用 rounded-none 的尖锐边角\",\n    \"禁止使用 shadow-2xl 等过重的阴影\",\n    \"禁止使用渐变按钮（保持扁平设计）\",\n    \"禁止在正文中使用花哨字体\",\n    \"禁止元素间距过于紧凑\",\n    \"禁止使用超过 duration-200 的动画（企业 UI 要利落，不要飘逸）\",\n    \"禁止 focus:ring 缺少 focus:ring-offset-2（ring-offset 让焦点环与元素分离，符合 WCAG）\",\n    \"禁止按钮缺少 active:scale-[0.98]（没有按压反馈，按钮像装饰品）\",\n  ],\n\n  dontListEn: [\n    \"Do not use overly vivid color combinations\",\n    \"Do not use sharp corners rounded-none\",\n    \"Do not use heavy shadows shadow-2xl and above\",\n    \"Do not use gradient buttons (maintain flat design)\",\n    \"Do not use fancy fonts for body text\",\n    \"Do not use overly tight element spacing\",\n    \"Do not use animations exceeding duration-200 (enterprise UI should be crisp, not floaty)\",\n    \"Do not use focus:ring without focus:ring-offset-2 (ring-offset separates focus ring from element, required for WCAG)\",\n    \"Do not omit active:scale-[0.98] on buttons (no press feedback makes buttons feel like decoration)\",\n  ],\n\n  components: {\n    button: {\n      name: \"按钮\",\n      description:\n        \"企业级按钮三态：hover 轻微上浮 + 阴影微升，active:scale-[0.98] 触觉按压确认，focus:ring-offset-2 WCAG 合规焦点环\",\n      code: `{/* Primary Button */}\n<button className=\"\n  px-4 py-2\n  bg-blue-600 text-white\n  rounded-lg shadow-sm font-medium\n  hover:bg-blue-700 hover:-translate-y-0.5 hover:shadow\n  focus:outline-none focus:ring-2 focus:ring-blue-500 focus:ring-offset-2\n  active:scale-[0.98] active:translate-y-0 active:shadow-sm\n  transition-all duration-150 ease-out\n\">\n  Get Started\n</button>\n\n{/* Secondary Button */}\n<button className=\"\n  px-4 py-2\n  bg-white text-gray-700\n  border border-gray-300 rounded-lg shadow-sm font-medium\n  hover:bg-gray-50 hover:-translate-y-0.5 hover:shadow\n  focus:outline-none focus:ring-2 focus:ring-gray-300 focus:ring-offset-2\n  active:scale-[0.98] active:translate-y-0 active:shadow-sm\n  transition-all duration-150 ease-out\n\">\n  Learn More\n</button>\n\n{/* Ghost Button */}\n<button className=\"\n  px-4 py-2\n  text-blue-600\n  rounded-lg font-medium\n  hover:bg-blue-50 hover:-translate-y-0.5\n  focus:outline-none focus:ring-2 focus:ring-blue-500 focus:ring-offset-2\n  active:scale-[0.98] active:translate-y-0 active:bg-blue-100\n  transition-all duration-150 ease-out\n\">\n  Cancel\n</button>`,\n    },\n    card: {\n      name: \"卡片\",\n      description:\n        \"企业卡片：hover 时轻微上浮 + 阴影微升；图标容器 hover 时蓝色填充 + scale-110 微交互\",\n      code: `<div className=\"\n  bg-white rounded-xl shadow-sm border border-gray-200 p-6\n  hover:shadow-md hover:-translate-y-0.5\n  transition-all duration-200 ease-out\n\">\n  <div className=\"flex items-center gap-3 mb-4\">\n    {/* Icon container — hover triggers color fill + scale */}\n    <div className=\"\n      group w-10 h-10\n      bg-blue-50 rounded-lg\n      flex items-center justify-center\n      hover:bg-blue-500 hover:scale-110\n      transition-all duration-200 ease-out\n      cursor-default\n    \">\n      <svg className=\"w-5 h-5 text-blue-600 group-hover:text-white transition-colors duration-200\" fill=\"none\" stroke=\"currentColor\" viewBox=\"0 0 24 24\">\n        <path strokeLinecap=\"round\" strokeLinejoin=\"round\" strokeWidth={1.5} d=\"M13 10V3L4 14h7v7l9-11h-7z\" />\n      </svg>\n    </div>\n    <h3 className=\"text-lg font-semibold text-gray-900\">Feature Title</h3>\n  </div>\n  <p className=\"text-gray-600 leading-relaxed text-sm\">\n    Description of the feature with clear, professional language.\n  </p>\n  <button className=\"\n    mt-4 px-3 py-1.5\n    bg-blue-600 text-white text-sm\n    rounded-lg shadow-sm font-medium\n    hover:bg-blue-700 hover:-translate-y-0.5 hover:shadow\n    focus:outline-none focus:ring-2 focus:ring-blue-500 focus:ring-offset-2\n    active:scale-[0.98] active:translate-y-0 active:shadow-sm\n    transition-all duration-150 ease-out\n  \">\n    Learn More\n  </button>\n</div>`,\n    },\n    input: {\n      name: \"输入框\",\n      description: \"企业风格输入框：聚焦时蓝色焦点环 + ring-offset，无 outline\",\n      code: `<div className=\"space-y-1.5\">\n  <label className=\"block text-sm font-medium text-gray-700\">Email Address</label>\n  <input\n    type=\"email\"\n    className=\"\n      w-full px-3 py-2\n      bg-white border border-gray-300\n      rounded-lg text-gray-900\n      placeholder:text-gray-400\n      focus:outline-none focus:ring-2 focus:ring-blue-500 focus:ring-offset-2 focus:border-blue-500\n      transition-all duration-150 ease-out\n    \"\n    placeholder=\"you@company.com\"\n  />\n  <p className=\"text-xs text-gray-500\">We'll never share your email.</p>\n</div>`,\n    },\n    nav: {\n      name: \"导航栏\",\n      description: \"企业风格顶部导航，链接 hover 轻微上移，CTA 按钮带触觉反馈\",\n      code: `<nav className=\"bg-white border-b border-gray-200 px-6 py-3\">\n  <div className=\"max-w-6xl mx-auto flex items-center justify